{
  "$schema": "https://uipotion.com/schema/categories/components.schema.json",
  "id": "toast-notifications",
  "version": "1.1.0",
  "name": "Toast Notifications",
  "category": "components",
  "tags": [
    "toast",
    "notifications",
    "snackbar",
    "feedback",
    "alerts",
    "a11y",
    "wcag",
    "aria",
    "queue",
    "auto-dismiss"
  ],
  "description": "Toasts that tell people what just happened without interrupting them: two live regions in the page from the start, errors and toasts with an action that stay until dismissed, timers that pause on hover, focus, and a hidden page, F8 to reach them, and a stack at the bottom that never covers what has focus.",
  "tokens": {
    "note": "Suggested defaults. The project's design tokens and existing components win.",
    "layout": {
      "toastWidthPx": 380,
      "edgeGapPx": 16,
      "toastGapPx": 12,
      "toastPaddingPx": "12 to 16",
      "borderRadiusPx": 10,
      "buttonMinPx": 32,
      "touchTargetPx": 44,
      "maxVisible": {
        "wideScreens": 3,
        "phones": 1
      },
      "phoneBreakpointMaxPx": 767
    },
    "motion": {
      "enterMs": 250,
      "exitMs": 200,
      "enterEasing": "cubic-bezier(0.16, 1, 0.3, 1)"
    },
    "timing": {
      "autoDismissMs": 5000,
      "autoDismissRangeMs": "4000 to 6000, longer for longer text",
      "errorsAndActions": "stay until dismissed"
    }
  },
  "aiAgentInstructions": {
    "summary": "Build or extend a toast stack: brief news about something that just happened, read out through two live regions that are in the page from the start (polite, and alert for errors), with errors and toasts with an action staying until dismissed, timers that pause on hover, focus, and a hidden page, F8 to move focus to the newest toast and back, Escape inside a toast, and a stack at the bottom that focus scrolls clear of. Build on the project's toast component when it has a suitable one. Implement only what the task needs, keep existing APIs, and match the project's styling and tokens. The project's conventions win for styling and visual defaults; if one conflicts with an accessibility or correctness requirement in this guide, ask the user instead of choosing silently. Target WCAG 2.2 AA.",
    "keyFeatures": [
      "Two live regions in the page from the start, polite and alert, not atomic, never hidden and never nested",
      "Errors and toasts with an action stay until dismissed; the rest leave after about 5 seconds",
      "Timers that pause while the stack is hovered or has focus, or the page is hidden",
      "F8 to the newest toast and back, Escape only inside a toast, and focus returned to where it came from when a toast goes",
      "A stack at the bottom, at most three toasts (one on phones) with the rest shown in order, and focus kept clear of it, also when a toast appears over the focused element",
      "Toasts below modals; a modal's own results show in the modal"
    ],
    "implementationSteps": [
      "1. Detect the framework and its version, the styling system, the tokens, and the existing components (projectDetection). If the project already has a toast or notification component, configure or extend it to meet this guide instead of building another one, and keep its API.",
      "2. Check that a toast fits the message (implementationDetails.whenToUse).",
      "3. Build the stack and its live regions (componentSpec.anatomy, frameworkPatterns.toastStack).",
      "4. Add the timing, the keys, and focus (implementationDetails.timing, implementationDetails.keysAndFocus, frameworkPatterns.toastTimers).",
      "5. Place the stack and keep focus clear of it (implementationDetails.stack, implementationDetails.phones), then the optional motion.",
      "6. Check the result against testingChecklist with a keyboard, a screen reader, a phone, and an open modal, and run the project's existing tests and checks."
    ]
  },
  "componentSpec": {
    "goal": "Tell people what just happened without interrupting them, in a way screen readers announce, keyboard users can reach, and nobody misses for lack of time.",
    "anatomy": {
      "slots": [
        "stack",
        "toast",
        "icon",
        "title",
        "description",
        "action",
        "dismiss",
        "politeRegion",
        "alertRegion"
      ],
      "hierarchy": "section \"Notifications\" (the stack) → list → toast → icon, title and description, optional action, Dismiss; beside the section, two live regions, polite and alert, that read the toasts out",
      "slotNotes": {
        "stack": "One <section> named \"Notifications\" holds the toasts, newest last, at the bottom of the screen: at the inline end on wide screens, and as wide as the screen less 32 px on phones. A top corner would sit over the header's own controls (an account menu, a theme choice) and could hide one entirely when it has focus (2.4.11), so toasts go to the bottom on every screen. On a page with a fixed bottom bar, such as a purchase bar or a tab bar, the script measures the bar and sets --bottom-bar-height to its height, and the stack sits above it, so the bar's controls stay visible.",
        "liveRegions": "Two live regions read the toasts out: role=\"status\" (polite), and role=\"alert\" for errors that need attention now; warnings and the rest are polite. Both are in the page, empty, from the start, outside the section, and never hidden: a live region inside a hidden element drops out of the accessibility tree (checked in Chromium). Neither is atomic (aria-atomic=\"false\"): both roles are atomic unless told otherwise, and an atomic region is read out whole each time a message is added, the earlier ones still in it included. Each toast's words go into one of them, and go when the toast goes; the toasts themselves aren't in a live region, so nothing is nested.",
        "buttons": "Each toast has a Dismiss button (an icon button named \"Dismiss\"), and its action is a button named by its visible text (\"Undo\")."
      }
    },
    "stateModel": {
      "toasts": {
        "type": "array",
        "description": "The toasts shown, oldest first: id, variant, title, description, action, and the time left.",
        "default": [],
        "persistence": "component state only"
      },
      "waiting": {
        "type": "array",
        "description": "Toasts waiting for room, in order; they show while there's room, after a dismissal or when the screen widens, and each is read out when it shows.",
        "default": [],
        "persistence": "component state only"
      },
      "paused": {
        "type": "boolean",
        "description": "True while the stack is hovered or has focus, or the page is hidden; the timers keep the time left.",
        "default": false,
        "persistence": "component state only"
      },
      "returnFocus": {
        "type": "object",
        "description": "The element focus came from when it entered the stack, by F8, Tab, or a click, for F8 again and for the last toast going; the main content when it's gone.",
        "default": null,
        "persistence": "component state only"
      }
    },
    "interactions": [
      {
        "event": "show",
        "result": "addToastOrWait",
        "sideEffects": [
          "addItsWordsToTheRightLiveRegion",
          "startItsTimerUnlessItsAnErrorOrHasAnAction"
        ],
        "accessibilityNotes": "Focus doesn't move. A toast with an action says \"Press F8 for\" the action."
      },
      {
        "event": "timerEnds",
        "result": "dismissToast",
        "sideEffects": [
          "showTheNextWaitingToast"
        ]
      },
      {
        "event": "pauseChange",
        "when": "the pointer enters or leaves the stack, focus enters or leaves it, or the page is hidden or shown",
        "result": "pauseOrResumeTimers",
        "accessibilityNotes": "Timers go on with the time that was left."
      },
      {
        "event": "f8",
        "result": "moveFocusToTheNewestToastOrBack",
        "preventDefault": true
      },
      {
        "event": "escape",
        "when": "focus is in a toast",
        "result": "dismissThatToast",
        "preventDefault": true,
        "accessibilityNotes": "Escape anywhere else is left to dialogs and menus."
      },
      {
        "event": "dismissOrAction",
        "result": "runTheActionAndDismissTheToast",
        "sideEffects": [
          "showWaitingToastsInOrderWhileThereIsRoom"
        ],
        "accessibilityNotes": "If the toast had focus, focus moves to the newest other toast, or back to where it was before it entered the stack, or to the main content."
      },
      {
        "event": "screenSizeChange",
        "result": "showWaitingToastsInOrderWhileThereIsRoom",
        "accessibilityNotes": "When the screen narrows, the toasts already showing stay."
      },
      {
        "event": "stackAppearsOrGrows",
        "when": "it covers the element that has focus",
        "result": "scrollTheFocusedElementClear",
        "accessibilityNotes": "Scroll padding acts only when something scrolls, so this is done by the script."
      },
      {
        "event": "viewportShrinks",
        "when": "the window or an on-screen keyboard brings the stack over the element that has focus",
        "result": "scrollTheFocusedElementClear"
      },
      {
        "event": "bottomBarChanges",
        "when": "a fixed bottom bar appears, hides, or changes height",
        "result": "moveTheStackAboveTheBarAndScrollTheFocusedElementClear"
      }
    ],
    "responsiveBehavior": {